{
  "version": 1,
  "docs_dir": "docs",
  "workspaces": [
    {
      "path": ".",
      "adapter": "shell",
      "name": null
    }
  ],
  "include": [
    "src/**"
  ],
  "exclude": [
    "**/testdata/**",
    "**/*_test.go",
    "**/node_modules/**"
  ],
  "bare": "auto",
  "settings_file": null,
  "models": {
    "plan": {
      "model": "claude-opus-5",
      "effort": "high"
    },
    "tutorial": {
      "model": "claude-opus-5",
      "effort": "high"
    },
    "explanation": {
      "model": "claude-opus-5",
      "effort": "high"
    },
    "howto": {
      "model": "claude-sonnet-5",
      "effort": "medium"
    },
    "reference": {
      "model": "claude-sonnet-5",
      "effort": "medium"
    },
    "reference_bulk": {
      "model": "claude-haiku-4-5"
    },
    "audit": {
      "model": "claude-sonnet-5",
      "effort": "medium"
    },
    "fallback": "claude-sonnet-5"
  },
  "budget_usd": 50.0,
  "verify": {
    "mode": "sandbox",
    "required": true,
    "max_repairs": 2,
    "sandbox_command": "$DIATAXIS_ROOT/share/sandbox/verify-sandbox.sh",
    "executable_languages": [
      "bash",
      "sh",
      "console"
    ]
  },
  "audit": {
    "fail_on": [
      "error"
    ],
    "model_audit_in_check": false
  },
  "voice": {
    "style_guide": "google",
    "person": "second",
    "extra_instructions_file": null
  }
}
